{
  "afirmaciones": [
    {
      "marca": "01:32",
      "texto": "Jev no genera tokens ni conversa: solo devuelve decisiones de tres tipos (sí/no con confianza, elección de categoría y puntuación en escala) según criterios que define el usuario.",
      "tipo": "dato"
    },
    {
      "marca": "01:02",
      "texto": "Está entrenado con RLCD, aprendizaje por refuerzo para decisiones calibradas, desarrollado durante dos años por Diogo, coinventor de ChatGPT.",
      "tipo": "dato"
    },
    {
      "marca": "02:34",
      "texto": "Según su creador, es de 20 a 200 veces más rápido y de 40 a 400 veces más barato, con tokens de salida gratuitos.",
      "tipo": "dato"
    },
    {
      "marca": "03:35",
      "texto": "Su ventana de contexto de entrada es de 64.000 tokens, frente al millón de modelos como Claude o GPT, y no puede escribir, resumir ni analizar.",
      "tipo": "dato"
    },
    {
      "marca": "06:09",
      "texto": "Clasificó 1.000 correos con siete reglas simultáneas en unos 70 segundos por 9 centavos; GPT-5.6 Luna tardó 5 minutos y costó 62 centavos.",
      "tipo": "demostración"
    },
    {
      "marca": "06:40",
      "texto": "Tras paralelizar el back-end con cargas útiles mayores, la misma clasificación de 1.000 correos bajó a 6 segundos por los mismos 9 centavos.",
      "tipo": "demostración"
    },
    {
      "marca": "10:15",
      "texto": "Una extensión de Chrome con Jev en el back-end etiqueta los tuits del feed de X en tiempo real como noticia, pepita de oro o bazofia de IA.",
      "tipo": "demostración"
    },
    {
      "marca": "08:42",
      "texto": "Su consola muestra casi 20.000 solicitudes a Jev por un total de 85 centavos.",
      "tipo": "dato"
    },
    {
      "marca": "14:53",
      "texto": "Un bot de paper trading con Jev decide cada segundo si Bitcoin sube o baja; ejecutarlo 24/7 costaría unos 2 dólares al día, aunque las comisiones cuestan más que las decisiones.",
      "tipo": "demostración"
    },
    {
      "marca": "12:48",
      "texto": "No hay que fiarse de Jev automáticamente: conviene evaluar con un conjunto de referencia de 100 casos con respuesta correcta y comparar precisión y coste contra otros modelos.",
      "tipo": "opinión"
    },
    {
      "marca": "04:06",
      "texto": "El patrón recomendado es que Jev filtre y clasifique el corpus barato y rápido, y que un modelo generativo más caro procese solo lo que pasa el filtro.",
      "tipo": "opinión"
    },
    {
      "marca": "15:23",
      "texto": "En uso de navegador Jev solo puede decidir, no escribir: necesita traspasar el control a otro modelo, así que hay que pensar dónde está el punto de traspaso.",
      "tipo": "opinión"
    }
  ],
  "autor": "Nate Herk | AI Automation",
  "avisos_transcripcion": [
    "Traducción automática del inglés: el nombre del modelo aparece como 'Jev', 'Jebb' (03:04) y 'Jeff' (12:48, 13:19); es el mismo producto.",
    "En 09:13 'mis publicaciones escolares' parece referirse a los posts de su comunidad (plataforma tipo Skool), no a contenido escolar.",
    "En 01:02 'Type Safe' / 'Type Safe AI' es la empresa creadora de Jev; grafía incierta por la traducción.",
    "En 01:02 se dice que Diogo 'co-inventó ChatGPT'; es la afirmación literal del vídeo, sin más fuente."
  ],
  "demuestra": "Clasificación en directo de 1.000 correos y 1.000 comentarios de YouTube con comparativa de coste y tiempo frente a GPT-5.6 Luna, la extensión de Chrome etiquetando el feed de X en tiempo real, un panel de análisis de transcripciones de reuniones y el bot de paper trading de Bitcoin decidiendo cada segundo.",
  "entidades": [
    "Jev",
    "Typesafe AI",
    "Diogo",
    "RLCD",
    "GPT-5.6 Luna",
    "Terra",
    "Soul",
    "Opus",
    "GPT-6 Astra",
    "Fable",
    "Vercel AI Gateway",
    "OpenRouter",
    "Fireflies",
    "Granola",
    "Nate Herk"
  ],
  "fecha": "2026-09-19",
  "fuente": "youtube",
  "huella": "f4a9f428f6762bf302fc39cf9fa9e9588e565f17a8590f12e08d1ca70ed522ac",
  "id": "ymgH8jS6Wb8",
  "preguntas_abiertas": [
    "Qué precisión real tiene Jev frente a modelos generativos sobre los mismos datos etiquetados.",
    "Cómo de fiables son sus puntuaciones de confianza, es decir, si la calibración que da nombre a RLCD se sostiene en dominios nuevos.",
    "Cuánto cuesta un error de clasificación en producción (correo urgente enrutado mal, lead descartado) frente al ahorro por solicitud.",
    "Si el límite de 64.000 tokens de entrada obliga a trocear corpus grandes y con qué efecto en la consistencia."
  ],
  "promete_sin_demostrar": "Que la calidad de las decisiones de Jev iguala a la de los modelos frontera: en ningún caso muestra una evaluación de precisión, solo coste y velocidad; los multiplicadores 20-200x y 40-400x salen del anuncio del propio creador; y la afirmación de que 'cambiará las reglas del juego' en atención al cliente y trading queda en hipótesis (el trading ni siquiera cubre comisiones).",
  "senales": {
    "dias": 25,
    "interaccion": 0.011,
    "multiplo_mediana": 2.9
  },
  "subtemas": [
    "modelos de clasificación sin chat",
    "enrutado a modelos baratos",
    "comparativa de coste y velocidad",
    "evaluaciones antes de producción"
  ],
  "tema": "Herramientas de IA",
  "tesis": "Jev, un modelo que solo emite decisiones calibradas (sí/no, categoría, puntuación) sin generar texto, abarata y acelera tanto la clasificación a escala que cambia la economía de las automatizaciones, siempre que se encadene con modelos generativos para el resto del trabajo.",
  "url": "https://www.youtube.com/watch?v=ymgH8jS6Wb8"
}
