{
  "afirmaciones": [
    {
      "marca": "01:32",
      "texto": "Un vídeo de 14 minutos se redujo a 9 tras pasarle dos grabaciones (cámara y pantalla): el agente transcribió, recortó errores y silencios, y añadió fondo, recortes redondeados y tarjetas de transición.",
      "tipo": "demostración"
    },
    {
      "marca": "02:34",
      "texto": "Le dio skills para decidir encuadre según contexto: cuando no pasa nada en pantalla muestra la cámara a pantalla completa y vuelve a la vista tutorial cuando toca enseñar algo.",
      "tipo": "demostración"
    },
    {
      "marca": "03:04",
      "texto": "Muestra dos reels de formato corto generados con el flujo (uno sobre el método de tres capas de Karpathy, otro de un patrocinio), con gancho visual, bucle abierto, B-roll recopilado o generado por el agente, subtítulos, música y efectos sincronizados.",
      "tipo": "demostración"
    },
    {
      "marca": "07:10",
      "texto": "Para un anuncio de AIS Live, el agente recolectó B-roll real de sus vídeos de YouTube, sesiones pasadas del evento y hasta fue a su Google Drive a buscar el logo para animarlo al final.",
      "tipo": "demostración"
    },
    {
      "marca": "10:17",
      "texto": "La configuración consiste en crear un proyecto local en Codex, pegarle la URL del repositorio de GitHub de Hyperframes y pedirle que instale dependencias e integre las skills.",
      "tipo": "demostración"
    },
    {
      "marca": "11:20",
      "texto": "El flujo conceptual tiene cuatro fases: transcribir (con precisión de milisegundo para sincronizar), recortar errores y silencios, planificar los tiempos (cada escena es un 'tiempo' que el modelo planifica leyendo el texto y entendiendo la intención) y un bucle final de verificación con capturas.",
      "tipo": "opinión"
    },
    {
      "marca": "13:55",
      "texto": "Para transcribir prefiere ElevenLabs (plan desde unos cinco dólares al mes, clave API restringida a voz-a-texto) frente a Whisper, gratuito pero más lento; la clave se guarda en un archivo .env del proyecto.",
      "tipo": "dato"
    },
    {
      "marca": "15:28",
      "texto": "El agents.md explica cómo funciona el proyecto y se actualiza con reglas de trabajo ('siempre que Nate pida transcribir, usa ElevenLabs'); es donde se acumulan tus preferencias de edición.",
      "tipo": "demostración"
    },
    {
      "marca": "17:33",
      "texto": "Construye en directo la intro del vídeo con un comando /goal y un prompt enorme que especifica escena a escena qué debe aparecer, dónde y con qué estética (diseño tipo Apple, cristal líquido).",
      "tipo": "demostración"
    },
    {
      "marca": "24:49",
      "texto": "La primera versión tardó 18 minutos y redujo la intro de 1:05 a 28 segundos; la segunda iteración con feedback concreto (texto más grande, abanico de vídeos más realista) tardó 10 minutos.",
      "tipo": "demostración"
    },
    {
      "marca": "26:22",
      "texto": "Hyperframes genera un estudio local (HTML animado servido en localhost) donde se pueden ajustar manualmente elementos como el tamaño de fuente sin volver a lanzar un prompt.",
      "tipo": "demostración"
    },
    {
      "marca": "23:15",
      "texto": "Cuando obtienes un resultado que te gusta, pides 'convierte eso en una skill' y las siguientes veces basta con 'edita este vídeo, usa la skill' más feedback puntual que también actualiza la skill.",
      "tipo": "opinión"
    }
  ],
  "autor": "Nate Herk | AI Automation",
  "avisos_transcripcion": [
    "El guion del reel patrocinado se transcribe en 00:00 como 'Nvidia' y en 04:05 como 'Invideo' siendo el mismo anuncio; probablemente el patrocinador correcto es uno solo",
    "En 03:35 dice 'el método de Perplexity' donde por contexto debería ser el método de Karpathy; probable error de transcripción automática",
    "Nombres deformados a lo largo del vídeo: 'Codec'/'códecs' por Codex (01:01, 22:12, 24:18), '11 Labs' por ElevenLabs, y en 29:26 'la versión de GPT-3' donde por contexto sería GPT-6"
  ],
  "demuestra": "Enseña funcionando el flujo completo de principio a fin: instalación de Hyperframes en un proyecto local de Codex, configuración de la clave de ElevenLabs en .env, regla añadida al agents.md, el prompt íntegro dictado en directo (especificación escena a escena), la primera versión renderizada en 18 minutos, una segunda iteración con feedback y una tercera variante, además de ejemplos ya producidos (vídeo de curso recortado de 14 a 9 minutos, dos reels, un anuncio con B-roll propio y logo sacado de Google Drive).",
  "entidades": [
    "Codex",
    "GPT-6 Astra",
    "Hyperframes",
    "ElevenLabs",
    "Whisper",
    "Nate Herk",
    "Andrej Karpathy",
    "Google Drive",
    "GitHub"
  ],
  "fecha": "2026-09-08",
  "fuente": "youtube",
  "huella": "87e4a4ee92ba5976b82f2ed2bfcfd0d1aab10bc95b78e3e0cc2fdb321b41f8a7",
  "id": "o3IEkKXXXvo",
  "preguntas_abiertas": [
    "Cuánto cuesta en API (ElevenLabs más el modelo) una edición típica y cómo escala con la duración del vídeo",
    "Qué contienen exactamente las skills del kit y cómo se adaptan a una identidad visual distinta de la del autor",
    "El patrón del vídeo (especificación detallada, verificación, entorno con agents.md) es el método de tres capas de Karpathy aplicado: ¿funciona igual para flujos de contenido escrito?",
    "Hasta qué punto la calidad depende de saber dictar un prompt de especificación tan detallado, una destreza de dirección que el vídeo da por supuesta",
    "Qué límites tiene el estudio local de Hyperframes frente a un editor tradicional para ajustes finos en vídeos largos"
  ],
  "promete_sin_demostrar": "Afirma que el mismo flujo sirve para crear vídeos desde cero sin material de origen (promos, demos de software) pero no lo enseña; promete que las skills del 'kit de estudiante' de su comunidad permiten replicar los reels sin mostrar su contenido; no muestra costes totales de API ni qué pasa cuando la verificación no converge.",
  "senales": {
    "dias": 36,
    "interaccion": 0.013,
    "multiplo_mediana": 2.71
  },
  "subtemas": [
    "edición de vídeo con agentes",
    "archivos de contexto",
    "componentes reutilizables",
    "reducción de ambigüedad",
    "verificación del resultado"
  ],
  "tema": "Contenido y curación con IA",
  "tesis": "Guía completa para montar un flujo de edición de vídeo con la app de escritorio de Codex (GPT-6 Astra) y Hyperframes: el trabajo duro es un primer prompt larguísimo y muy específico que recorre transcribir, cortar, planificar tiempos y verificar en bucle; después todo se reduce a consolidar lo aprendido en skills y en el agents.md para no repetirse.",
  "url": "https://www.youtube.com/watch?v=o3IEkKXXXvo"
}
