{
  "afirmaciones": [
    {
      "marca": "00:00",
      "texto": "Muse se convirtió rápidamente en la aplicación número uno de la Apple App Store.",
      "tipo": "dato"
    },
    {
      "marca": "00:31",
      "texto": "La demo de Dots falló en directo durante el Dev Day de OpenAI y lo disimularon en la retransmisión.",
      "tipo": "dato"
    },
    {
      "marca": "01:31",
      "texto": "Ambos son agentes persistentes en la nube, con su propia computadora en la nube, horarios y conectores de inicio de sesión único.",
      "tipo": "dato"
    },
    {
      "marca": "01:31",
      "texto": "Dots funciona con GPT-6 Astra y Muse con Muse Spark 1.3.",
      "tipo": "dato"
    },
    {
      "marca": "02:34",
      "texto": "Dots arranca con la memoria de ChatGPT del usuario y desde ahí desarrolla su propio contexto.",
      "tipo": "demostración"
    },
    {
      "marca": "03:05",
      "texto": "Muse expone un archivo de alma (personalidad) y un archivo de memoria (hechos, preferencias, compromisos) editables desde la interfaz.",
      "tipo": "demostración"
    },
    {
      "marca": "04:38",
      "texto": "Integrar Dots en Slack son tres clics; el equipo puede escribirle en un canal y responde en hilos.",
      "tipo": "demostración"
    },
    {
      "marca": "05:38",
      "texto": "Muse tiene conector nativo de WhatsApp: responde en tiempo real desde WhatsApp y la app solo visualiza ese hilo.",
      "tipo": "demostración"
    },
    {
      "marca": "06:40",
      "texto": "La versión gratuita de Muse da hasta 100 millones de tokens por semana; para crear un dot hace falta suscripción de pago de ChatGPT.",
      "tipo": "dato"
    },
    {
      "marca": "07:12",
      "texto": "De momento OpenAI no descuenta el uso de Dots de la suscripción, pero es solo para fomentar la adopción y acabarán cobrándolo.",
      "tipo": "opinión"
    },
    {
      "marca": "08:44",
      "texto": "El pulso de Muse se ejecuta cada 30 minutos y revisa proactivamente documentos de Google y correo para enviar alertas y recordatorios.",
      "tipo": "dato"
    },
    {
      "marca": "11:49",
      "texto": "Dots no sabe cómo funciona él mismo: da instrucciones de gestión de tareas programadas que no existen en su interfaz.",
      "tipo": "demostración"
    },
    {
      "marca": "13:53",
      "texto": "Muse, Grokbot y Dots probablemente se fusionarán funcionalmente en una sola categoría de herramienta; las diferencias serán conectores, modelo subyacente y precio.",
      "tipo": "opinión"
    },
    {
      "marca": "15:27",
      "texto": "Dots se siente apresurado y con muchos errores: copia a Muse sin alcanzar su pulido pese a tener el ejemplo delante.",
      "tipo": "opinión"
    }
  ],
  "autor": "Nate Herk | AI Automation",
  "avisos_transcripcion": [
    "Traducción automática del inglés: en 01:31 'GBD-6 Astra' debe ser GPT-6 Astra.",
    "En 02:34 'Anydyne' es un nombre de producto degradado por la traducción, grafía incierta.",
    "En 11:18 'conexión de ranura' parece traducción literal de 'Slack connection'.",
    "En 12:20 'Herk too' / 'proyecto Herk too' es el nombre del proyecto personal del autor (Herk 2), degradado."
  ],
  "demuestra": "Recorrido real por ambas apps: memoria y alma editables de Muse, feed de ideas y objetivos, creación de artefactos y podcasts; Dots integrado en Slack respondiendo en hilos, Muse contestando por WhatsApp, la computadora en la nube con terminal de Dots y sus tareas programadas, incluida la escena en que Dots da instrucciones falsas sobre su propia interfaz.",
  "entidades": [
    "OpenAI",
    "Meta",
    "Dots",
    "Muse",
    "GPT-6 Astra",
    "Muse Spark 1.3",
    "ChatGPT",
    "Codex",
    "Claude Code",
    "Grokbot",
    "Slack",
    "WhatsApp",
    "Nate Herk"
  ],
  "fecha": "2026-09-30",
  "fuente": "youtube",
  "huella": "3bdde72ccbdea9882cefde35059f006c09c5403142636b2ef7a595d05f2e60c6",
  "id": "BvvfZKKz4Yo",
  "preguntas_abiertas": [
    "Qué implicaciones de privacidad tiene dar a un agente en la nube acceso permanente a memoria, correo, archivos locales y WhatsApp.",
    "Cuánto costará realmente usar Dots cuando termine la promoción de no descontar tokens.",
    "Si estas conclusiones aguantan más allá de un solo día de prueba con cada herramienta.",
    "Qué controles hay cuando todo un equipo de Slack puede dar órdenes al agente personal de otra persona."
  ],
  "promete_sin_demostrar": "Los benchmarks que harían a Astra 'más inteligente' que Spark se citan sin fuente; la convergencia futura de Muse, Grokbot y Dots y que OpenAI empezará a cobrar el uso de Dots son especulación del autor; el SOP para conseguir clientes es autopromoción sin evidencia en el vídeo.",
  "senales": {
    "dias": 14,
    "interaccion": 0.0076,
    "multiplo_mediana": 3.67
  },
  "subtemas": [
    "comparativa de modelos",
    "asistentes personales en la nube",
    "archivos de contexto",
    "tareas programadas",
    "integración con mensajería"
  ],
  "tema": "Herramientas de IA",
  "tesis": "Los asistentes personales persistentes en la nube (Dots de OpenAI y Muse de Meta) acabarán convergiendo en el mismo producto; hoy Muse gana en experiencia para no técnicos y Dots solo compensa si ya vives en el ecosistema ChatGPT/Codex.",
  "url": "https://www.youtube.com/watch?v=BvvfZKKz4Yo"
}
