{
  "afirmaciones": [
    {
      "marca": "03:07",
      "texto": "Jev es un 'enorme modelo de decisión': conserva la comprensión del contexto de un LLM pero salta directamente a la clasificación, sin generar la respuesta token a token.",
      "tipo": "opinión"
    },
    {
      "marca": "04:09",
      "texto": "Jev no aporta ninguna novedad conceptual al campo de la IA; su valor está en el esquema de costes y la velocidad que permite el cambio arquitectónico.",
      "tipo": "opinión"
    },
    {
      "marca": "05:42",
      "texto": "Jev es un orden de magnitud más barato que GPT-5.6 Luna, el modelo más barato de la saga 5.6 de OpenAI.",
      "tipo": "dato"
    },
    {
      "marca": "06:43",
      "texto": "En la frontera capacidad/precio, Jev queda casi a la par de Terra o Sonnet 5 en toma de decisiones estando casi dos órdenes de magnitud por debajo en precio.",
      "tipo": "dato"
    },
    {
      "marca": "07:15",
      "texto": "Jev cobra solo por los tokens de entrada; los de salida son gratis porque la respuesta es un único pase de inferencia, sin generación autorregresiva.",
      "tipo": "dato"
    },
    {
      "marca": "08:48",
      "texto": "Jev juega al Doom en tiempo real sin entrenamiento específico, usando los estados internos del juego (no tiene capacidades multimodales, no ve los píxeles).",
      "tipo": "demostración"
    },
    {
      "marca": "11:56",
      "texto": "Jev interactúa con Google Flights rellenando campos y tomando decisiones a partir de los estados del navegador, con acciones preestablecidas sobre qué elemento tocar.",
      "tipo": "demostración"
    },
    {
      "marca": "15:34",
      "texto": "En una app construida por el autor, Jev clasifica los vídeos de su canal según un criterio libre ('interpretabilidad de modelos') más rápido y con menos errores que GPT-5.6 Luna: 0,00046 frente a 0,015 de coste.",
      "tipo": "demostración"
    },
    {
      "marca": "16:36",
      "texto": "Clasificando por lotes de 20 vídeos, Jev devuelve decisiones casi instantáneas y más rigurosas, mientras GPT-5.6 Luna va más lento y marca como 'fundamentos' vídeos que no lo son.",
      "tipo": "demostración"
    },
    {
      "marca": "19:11",
      "texto": "Jev construye rutas de aprendizaje sobre el catálogo del canal decidiendo en tiempo real cuál es el siguiente vídeo a ver según el criterio del usuario.",
      "tipo": "demostración"
    },
    {
      "marca": "20:44",
      "texto": "Por ser general nunca será tan bueno como un clasificador entrenado específicamente para una tarea; un tuit citado muestra un bot de trading con Jev que hizo perder más de 30.000 dólares a su autor.",
      "tipo": "opinión"
    },
    {
      "marca": "12:57",
      "texto": "Los grandes laboratorios (Anthropic, OpenAI) acabarán ofreciendo modelos de este tipo que colaboren con sus modelos de lenguaje en flujos agénticos.",
      "tipo": "opinión"
    },
    {
      "marca": "21:47",
      "texto": "Ya aparecen alternativas open source que se acercan al rendimiento de Jev, alguna con multimodalidad añadida que le da visión al modelo.",
      "tipo": "dato"
    }
  ],
  "autor": "Dot CSV Lab ",
  "avisos_transcripcion": [
    "Transcripción de subtítulos automáticos: el nombre del modelo aparece sistemáticamente como 'Jeff' o 'Jeev' cuando el nombre oficial según la descripción del vídeo es 'Jev' (de la paradoja de Jevons), y la empresa aparece como 'TypeSe'/'Typeesave' (TypeSafe).",
    "[16:06] 'unos tres peces más caros' es un error de los subtítulos automáticos; por las cifras mostradas (0,015 vs 0,00046) probablemente dice 'unas treinta veces más caro', pero el número exacto no es fiable.",
    "[21:47] El nombre de la alternativa open source es confuso en los subtítulos ('diffusion yema as Jeff'); no se puede determinar el nombre real del modelo desde la transcripción.",
    "[05:12] La explicación del origen del nombre mezcla 'paradoja de Heevons/Jevensons'; se interpreta como paradoja de Jevons."
  ],
  "demuestra": "La comparativa en directo con una app propia: Jev clasificando todos los vídeos del canal del autor bajo criterios libres (interpretabilidad, fundamentos, tutoriales de programación, categorías dinámicas), individual y por lotes de 20, contra GPT-5.6 Luna, con cifras de coste en pantalla (0,00046 vs 0,015) y menos falsos positivos; y la ruta de aprendizaje construida en tiempo real sobre el catálogo. También muestra demos de terceros (Doom, Google Flights, outfits, assets de videojuego, clasificación de anuncios) reproducidas en pantalla pero no ejecutadas por él.",
  "entidades": [
    "Jev",
    "TypeSafe",
    "GPT-5.6 Luna",
    "GPT-6 Astra",
    "Sonnet 5",
    "Terra",
    "OpenAI",
    "Anthropic",
    "OpenRouter",
    "Doom",
    "Google Flights",
    "Carlos Santana (Dot CSV)",
    "paradoja de Jevons"
  ],
  "fecha": "2026-09-21",
  "fuente": "youtube",
  "huella": "adad0113a995285ee656d76e9b9a23e5ae97e9422e04414e7d70e81b8bffbeb1",
  "id": "AwYYpXfFM9k",
  "preguntas_abiertas": [
    "¿Qué arquitectura tiene Jev exactamente y cómo logra la generalidad sin generación autorregresiva?",
    "¿Cómo se definen en la práctica las clases o acciones preestablecidas (API, formato de entrada, límites de contexto)?",
    "¿Dónde está el umbral en que un clasificador entrenado específico sigue compensando frente a Jev?",
    "¿Qué fiabilidad tiene Jev en decisiones de más riesgo que clasificar vídeos (el bot de trading perdió dinero)?",
    "¿Cómo se comparan de verdad las alternativas open source mencionadas con el Jev propietario?"
  ],
  "promete_sin_demostrar": "Las cifras de la frontera capacidad/precio (a la par de Terra o Sonnet 5 con dos órdenes de magnitud menos de coste) vienen de las gráficas del propio TypeSafe, sin verificación independiente. La predicción de que Anthropic y OpenAI lanzarán modelos de este tipo es especulación. Las alternativas open source con visión se mencionan sin probarlas. Tampoco demuestra el control de ordenador más allá de reproducir la demo oficial de Google Flights, ni cuantifica cuándo compensa Jev frente a un clasificador entrenado ad hoc.",
  "senales": {
    "dias": 23,
    "interaccion": 0.0221,
    "multiplo_mediana": 3.82
  },
  "subtemas": [
    "modelos de clasificación sin chat",
    "comparativa de coste y velocidad",
    "especialización de modelos por tarea",
    "toma de decisiones delegada"
  ],
  "tema": "Herramientas de IA",
  "tesis": "Jev no aporta nada conceptualmente nuevo —es un clasificador generalista, un 'enorme modelo de decisión' en vez de un modelo de lenguaje— pero su velocidad y su coste, órdenes de magnitud menores, lo convierten en una pieza nueva y útil de la caja de herramientas para cualquier toma de decisiones delegada.",
  "url": "https://www.youtube.com/watch?v=AwYYpXfFM9k"
}
