{
  "afirmaciones": [
    {
      "marca": "00:00",
      "texto": "Afirma haber hecho 4 transformaciones completas de empresas en 4 meses y 3 sesiones grupales (7 fundadores en Ciudad del Cabo, 7 en Bali y unos 35 en Montenegro) configurando sistemas operativos de IA con Claude Code.",
      "tipo": "dato"
    },
    {
      "marca": "01:31",
      "texto": "Un sistema operativo de IA es un espacio de trabajo flexible que conecta el contexto del negocio con sus datos e integraciones para construir agentes, automatizaciones y aplicaciones encima.",
      "tipo": "opinión"
    },
    {
      "marca": "03:33",
      "texto": "Un sistema operativo de IA sobre Claude Code —un entorno de codificación personalizado con skills y gestión de contexto— no va a llegar al mercado masivo ni lo adoptará la mayoría de dueños de negocio en el futuro cercano.",
      "tipo": "opinión"
    },
    {
      "marca": "03:33",
      "texto": "Solo configurar a un fundador en una buena plantilla de Claude Code (claves API, contexto, exportaciones de ChatGPT, cuestionario) lleva un día entero, y después hay que formarle para que entienda el sistema.",
      "tipo": "dato"
    },
    {
      "marca": "04:03",
      "texto": "Le pone nervioso entregar el sistema a un dueño de negocio y retirarse, porque sin soporte continuo el cliente no extrae todo el valor; busca que el cliente se autogestione.",
      "tipo": "opinión"
    },
    {
      "marca": "05:05",
      "texto": "Su promesa comercial es comprimir 7 meses de progreso en IA en 7 días sin que él tenga que quedarse después.",
      "tipo": "opinión"
    },
    {
      "marca": "06:37",
      "texto": "En su última transformación configuró una división de contabilidad de 40 personas usando Kylon como plataforma para que sus agentes trabajaran juntos.",
      "tipo": "dato"
    },
    {
      "marca": "07:39",
      "texto": "Kylon patrocina el vídeo y la transformación mostrada; ofrece a su audiencia el primer mes gratis antes del plan de 100 dólares al mes.",
      "tipo": "dato"
    },
    {
      "marca": "09:45",
      "texto": "El onboarding de Kylon investiga la empresa a partir de su web (presencia social, LinkedIn) y construye el contexto del negocio, replicando la configuración de contexto que él hacía a mano.",
      "tipo": "demostración"
    },
    {
      "marca": "11:50",
      "texto": "Conecta YouTube y Gmail como fuentes de datos en un par de clics, frente a un día entero recopilando claves API y configurando Google Cloud en el enfoque a medida.",
      "tipo": "demostración"
    },
    {
      "marca": "13:22",
      "texto": "Kylon tiene una CLI con acceso programático al espacio de trabajo, que es como su equipo configuró la implantación para el cliente de contabilidad sin pasar por la interfaz.",
      "tipo": "dato"
    },
    {
      "marca": "16:27",
      "texto": "Crea un agente nuevo (personalidad, permisos, salas) y enseña las skills precargadas del agente por defecto: Apify, Apollo, sistema de diseño, uso de navegador, Google Trends, API de Kylon.",
      "tipo": "demostración"
    },
    {
      "marca": "17:29",
      "texto": "Instala skills propias soltando un zip de su espacio de trabajo en el chat y conectándolas a todos los agentes.",
      "tipo": "demostración"
    },
    {
      "marca": "19:02",
      "texto": "Construye una app de datos tipo tablero kanban (estilo Airtable) sobre una base de datos creada por los agentes dentro de la plataforma.",
      "tipo": "demostración"
    },
    {
      "marca": "20:34",
      "texto": "Un agente puede mencionar a otro y delegarle tareas: pide a un agente que ordene a otro publicar un mensaje en una sala y la cadena se ejecuta.",
      "tipo": "demostración"
    },
    {
      "marca": "21:05",
      "texto": "Cuenta que un aviso de Sentry por email disparó una cadena agente de correo → agente CTO → agente ingeniero que creó una solución y una PR a la espera de su aprobación; afirma que estamos muy cerca de operaciones de negocio sin intervención manual.",
      "tipo": "opinión"
    },
    {
      "marca": "19:32",
      "texto": "Todo lo mostrado (contexto, integraciones, agente, automatización y app) se configuró en unos 20-30 minutos.",
      "tipo": "dato"
    }
  ],
  "autor": "Liam Ottley",
  "avisos_transcripcion": [
    "Traducción automática al español degradada en todo el vídeo.",
    "El nombre de la plataforma aparece escrito de muchas formas (Kilon, Kylon, Kylo, Kilonn, Kylan, Kyro, Kyanon, Kylene, 06:07-19:32); se normaliza como Kylon por coherencia con el otro vídeo del canal.",
    "02:02: 'estructura de carpetas SKF' parece error de transcripción (¿scaffold?).",
    "06:07 'como un ATN para los agentes' y 06:37 'tienes A10' probablemente se refieren a n8n.",
    "11:20: 'Composure' probablemente es Composio.",
    "05:05: 'el sistema operativo de IA Claude Go' probablemente es Claude Code."
  ],
  "demuestra": "Un recorrido en directo por Kylon: onboarding que investiga la empresa desde su web y construye el contexto, conexión de YouTube y Gmail en pocos clics, creación de salas y de un agente con skills precargadas, una automatización programada, una app de datos tipo kanban sobre una base de datos nativa, y delegación de un mensaje entre dos agentes; todo en unos 20-30 minutos.",
  "entidades": [
    "Claude Code",
    "Kylon",
    "ChatGPT",
    "Slack",
    "Sentry",
    "Airtable",
    "Apify",
    "Liam Ottley"
  ],
  "fecha": "2026-09-08",
  "fuente": "youtube",
  "huella": "8bb41cef0d8f2a847fce0f898d5d4f1ac95a81b0f37772396d7c25af9ee01987",
  "id": "T2v2pf_uypE",
  "preguntas_abiertas": [
    "¿Qué se pierde al pasar de un sistema a medida sobre Claude Code a una plataforma cerrada: control, portabilidad del contexto, dependencia del proveedor?",
    "¿Cómo se comporta Kylon con volumen y casos reales más allá de la demo de 20-30 minutos?",
    "¿Cuánto del argumento se sostiene sin el patrocinio: compararía igual Kylon con alternativas (n8n, otros espacios de trabajo agénticos)?",
    "¿Qué pasa con los clientes cuando la startup que empaqueta el sistema cambia de precios, de rumbo o desaparece?",
    "¿Cómo se audita y supervisa lo que hacen los agentes entre sí en esas 'salas' cuando nadie mira?"
  ],
  "promete_sin_demostrar": "Que las plataformas empaquetadas sustituirán a los sistemas a medida sobre Claude Code para la mayoría de negocios; la promesa de '7 meses de progreso en 7 días'; la cadena Sentry→agentes→PR y las 'operaciones sin intervención manual' se relatan pero no se enseñan; la implantación en la división de contabilidad de 40 personas solo se menciona. Todo bajo patrocinio de Kylon, con incentivo económico declarado.",
  "senales": {
    "dias": 36,
    "interaccion": 0.0042,
    "multiplo_mediana": 2.73
  },
  "subtemas": [
    "plataforma empaquetada vs sistema a medida",
    "coste de construir el sistema",
    "archivos de contexto",
    "teams de agentes",
    "autogestión del cliente tras la entrega"
  ],
  "tema": "Agentes de IA",
  "tesis": "Los sistemas operativos de IA construidos a medida sobre Claude Code no van a llegar al dueño de negocio medio por su coste de configuración, formación y mantenimiento, así que conviene migrar a plataformas empaquetadas (Kylon) que replican el mismo modelo —contexto, datos, agentes, automatizaciones y apps— en un producto autogestionable.",
  "url": "https://www.youtube.com/watch?v=T2v2pf_uypE"
}
